10.46416,The Korean Cadastre Information Association,
10.46417,Journal of Animal Physiology and Nutrition,
10.46424,PHARMANEST : An International Journal of Advances in Pharmaceutical Sciences,
10.4472,DIAPHANES AG,
10.46435,Acta Universitatis de Carolo Eszterhazy Nominatae. Sectio philosophica,
10.46440,Acta Universitatis de Carolo Eszterhazy Nominatae. Sectio litterarum,
10.46437,Acta Universitatis de Carolo Eszterhay Nominatae. Sectio linguistica Hungarica,
10.46432,A Helyi Ertek,
10.46445,Sekolah Tinggi Teologi Simpson,
10.46434,Acta Universitatis de Carolo Eszterhazy Nominate: Germanistische Studien,
10.46444,LPPM IKIP Saraswati,
10.46442,Uluslararasi Kulturel ve Sosyal Arastirmalar Dergisi,
10.46441,Erdorezervatum Fuzetek,
10.46436,Acta Universitatis de Carolo Eszterhazy Nominatae. Sectio paedagogica,
10.46433,Historia Nostra,
10.46438,Acta Universitatis de Carolo Eszterhazy Nominatae. Sectio historiae,
10.46480,GDEON,
10.46946,Centro Espanol de Investigaciones Coreanas (CEIC),
10.46502,Editorial Primmate,
10.46503,Asociacion para la Formacion y la Investigacion en Ciencias Economicas y Sociales,
10.46663,Jinnah Sindh Medical University,
10.46500,Wallstein Verlag GmbH,
10.46556,Global Alliance for Incinerator Alternatives (GAIA),
10.46477,ICOM International Committee for Museums and Collections of Instruments and Music,
10.46533,"Scimpact, LLC",
10.46449,The Mirae English Language and Literature Assoication,
10.46447,Politeknik Keselamatan Transportasi Jalan,
10.46453,Turkish Society for Geomorphology,
10.46452,International Journal of Western Black Sea Social and Humanities Sciences,
10.46448,Afkar wa afak,
10.20377,Universitatsbibliothek Bamberg,
10.20378,Universitatsbibliothek Bamberg,
10.46708,"Lembaga Kajian Islam dan Hukum Islam, Faculty of Law, Universitas Indonesia",
10.46542,International Pharmaceutical Federation (FIP),
10.47245,UMR7044 ARCHIMEDE,
10.46618,Red de Centros de Investigacion en Matematica Educativa,
10.46571,Corporacion Universitaria Autonoma del Cauca,
10.46460,International Journal of Innovative Engineering Applications,
10.46458,Faculty of Economics University of Mostar,
10.46459,International Society of Personalized Medicine,
10.46463,International Journal of Recreation and Sport Science,
10.46464,"Turkish Journal of Earthquake Research, Disaster and Emergency Management Authority",
10.46465,Journal of Industrial Engineering,
10.46534,Green Roofs for Healthy Cities,
10.46607,International Ayurvedic Medical Journal,
10.46532,IJAICT India Publications,
10.46660,"International Journal of Economic and Environmental Geology (IJEEG), published by SEGMITE",
10.46581,International Academy of Microwave and Optical Technology (IAMOT),
10.46555,"Vyzkumny ustav vodohospodarsky T. G. Masaryka, v. v. i.",
10.46485,Journal of the Faculty of Arts and Media,
10.46484,Politeknik Ilmu Pelayaran (PIP) Semaran,
10.46482,Erzincan Binali Yildirim Universitesi Iktisadi ve Idari Bilimler Fakultesi Dergisi,
10.46486,Mezhdunarodnaya Media Gruppa,
10.46483,E-Journal of Dokuz Eylul University Nursing Faculty,
10.34671,Scientific Chronograph EOOD,
10.46488,Technoscience Publications,
10.46487,The Korean Society Of Modern Chinese Literature,
10.46585,Univerzita Pardubice,
10.46825,Holy Synod of Bishops of the Serbian Orthodox Church,
10.46492,Agricultural Technology Development Society,
10.46493,EDITORIAL BOARD FOREIGN AFFAIRS (FOREIGN AFFAIRS-UA),
10.46557,Asia-Pacific Applied Economics Association,
10.46494,Sekolah Tinggi Teologi Baptis Indonesia,
10.46569,San Francisco State University,
10.46850,sofia - Society for Institutional Analysis,
10.46496,"Jurnal Medula, Fakultas Kedokteran Universitas Halu Oleo",
10.46497,The Archives of Rheumatology,
10.46495,Sekolah Tinggi Theologia Nazarene Indonesia,
10.47331,Association of Oncologists of Uzbekistan,
10.36159,ED MARKETING  AND COMMUNICATION di Edoardo Desiderio,
10.46521,Pakistan Association for Women's Studies,
10.46509,"Airman: Jurnal Teknik dan Keselamatan Transportasi, Politeknik Penerbangan Makassar",
10.46514,The National University Journal,
10.46505,International Journal of Biological Innovations,
10.46517,SEAMEO Regional Centre for QITEP in Mathematics,
10.46508,STIKes Wijaya Husada,
10.46512,Al-Bahtiyat,
10.46507,Pusat Penelitian Ilmu Sosial dan Humaniora Kontemporer,
10.46520,"Journal of BRSA Banking and Financial Markets, Banking Regulation and Supervision Agency of Turkey",
10.46515,Jordanian Education Journal,
10.46519,International Journal of 3D Printing Technologies and Digital Industry,
10.46522,Universitatea de Arta din Targu Mures,
10.46516,"Bau, Centre Universitari de Disseny",
10.46518,Korean Society of Neuromuscular Disorders,
10.46513,Muqarabat falsafiyat,
10.46511,Journal of Science and Humanities,
10.46506,International Society of Culture and Arts,
10.46510,Akademi Komunitas Negeri Putra Sang Fajar Blitar,
10.46526,Associacao Brasileira de Cultura de Tecidos de Plantas,
10.46524,"Journal of Business and Social Science Research, Ace Institute of Management",
10.46525,REVISTA ENCONTROS TEOLOGICOS,
10.46523,"Journal of Advance Research in Science and Social Science, IMHRC",
10.46527,YuMed Text Publications,
10.46528,JUNI KHYAT,
10.53486,Academy of Economic Studies,
10.53053,Simons Foundation,
10.46714,Simons Foundation,
10.46621,Society of Family Planning,
10.46631,Universidad ESAN,
10.47068,Asociatia Romana de Pteridologie,
10.47264,IDEA PUBLISHERS,
10.46605,Sociedad Iberoamericana de Estudios Heideggerianos,
10.46604,Taiwan Association of Engineering and Technology Innovation,
10.46587,"Institute of Sustainable Development, Environmental and Scientific Research (ISDESR)",
10.46620,International Union of Radio Science (URSI),
10.46606,Gitoya Centre for Academic Research and Dissemination,
10.46764,STMIK Syaikh Zainuddin NW Anjani-Lombok Timur,
10.46564,Institute for Research and Development India,
10.46549,Fakultas Peternakan Universitas Papua,
10.46548,"XXI Century: Resumes of the Past and Challenges of the Present plus, PenzSTU",
10.46550,Editora Ilustracao,
10.53369,Capital University of Science and Technology Islamabad,
10.46552,Sekolah Tinggi Agama Islam Nahdlatul Ulama Kotabumi Lampung,
10.46654,IJAAR Publishing,
10.46609,MIJP Publication,
10.46551,Universidade Estadual de Montes Claros (UNIIMONTES),
10.46579,"Scitech Central Inc., USA",
10.46559,Balai Riset dan Standardisasi Industri Bandar Lampung,
10.46617,SRO media,
10.46560,Universidade Fumec,
10.46558,Sekolah Tinggi Teologi Injili Setia Siau,
10.46566,"Institute of Management and Socio-economic Development, LLC",
10.46563,National Medical Research Center for Childrens Health,
10.46562,Scholars for English Studies in Korea,
10.46645,Scholars for English Studies in Korea,
10.46561,The Institute for Peace Affairs,
10.46567,Asosiasi Teolog Indonesia,
10.46565,Yeshwantrao Chavan College of Engineering,
10.46619,Tridha Scholars Publishing Pvt Ltd,
10.46656,ACCESS,
10.46650,Universitas Dwijendra,
10.46572,"NATURENGS MTU Journal of Engineering and Natural Sciences, Malatya Turgut Ozal University",
10.46573,Tver State Technical University,
10.53307,Harran University,
10.46578,Harran University,
10.30623,Harran University,
10.46576,Universitas Dharmawangsa,
10.46575,"AgriHumanis: Journal of Agriculture and Human Resource Development Studies, Balai Pelatihan Pertanian Jambi",
10.46574,Minangkabau Scholar Institute,
10.46713,Bulgarian Defence Institute - BDI,
10.46577,Korea National University of Arts,
10.46938,Institute of Philosophy of the Czech Academy of Sciences,
10.46957,Institute of Philosophy of the Czech Academy of Sciences,
10.51133,Institute of Philosophy of the Czech Academy of Sciences,
10.47376,Institute of Philosophy of the Czech Academy of Sciences,
10.46854,Institute of Philosophy of the Czech Academy of Sciences,
10.47046,Institute of Philosophy of the Czech Academy of Sciences,
10.46717,Union of Iraqi Geologists (UIG),
10.46652,Centro de Investigaciones en Ciencias Sociales y Humanidades desde America Latina,
10.36171,Societa Benefit AMD Srl SB,
10.46593,Bold Rapid Net. Pvt. Ltd.,
10.46596,"Kebikec, Insan Bilimleri icin Kaynak Arastirmalari Dergisi",
10.46592,Turkish Journal of Agricultural Engineering Research,
10.46595,Ozcan Gungor,
10.46594,ROSOMED,
10.46591,P.P. Revista JURNALUL UMANITAR MODERN S.R.L.,
10.46597,Instituto de Psicologia - USP,
10.46598,"Impact Journal of Science and Technology, Impact Care Foundation",
10.46599,Gyor-Moson-Sopron Megyei Epitesz Kamara,
10.46633,"Scholars Publishing, LLC",
10.46600,Pakistan Society of Religions (PSR),
10.46710,Centre d Estudis Demografics (CED),
10.53952,Universitas Gunung Rinjani,
10.46601,Universitas Gunung Rinjani,
10.54712,Universitas Gunung Rinjani,
10.46883,MJH Life Sciences,
10.46651,The Archaeological Society Malta,
10.46770,Atomic Spectroscopy Press Limited,
10.46911,Victorian Popular Fiction Association,
10.46711,Association science et bien commun,
10.46659,Escuela Colombiana de Ingenieria Julio Garavito,
10.46610,MAT Journals (A unit of ARV Infomedia Pvt. Ltd.),
10.46611,"Journal of Medical Sciences, Aksaray University",
10.46613,Sociedad Chilena de Gastroenterologia,
10.46612,Korea Association of Chinese Language and Literature,
10.48175,Naksh Solutions,
10.46632,REST Publisher,
10.46614,International Journal of Old Uyghur Studies,
10.47310,International Academic and Research Consortium,
10.46719,Dynamic Publishers,
10.46615,Izdatelstvo Prospekt,
10.46891,Badan Penelitian dan Pengembangan Daerah Kota Baubau,
10.46994,Instituto Aragones de Ciencias de la Salud (IACS),
10.46995,Instituto Aragones de Ciencias de la Salud (IACS),
10.52919,University of Oran 2 Mohamed Ben Ahmed,
10.46653,Pakistan Society for Horticultural Science,
10.46616,Revista Cientifica Educacao Online,
10.46626,Asian Forum For Corrections,
10.46624,Epixpub Publication,
10.46629,"Istanbul Yeni Yuzyil Universitesi, Yeni Yuzyil Journal of Medical Sciences",
10.46625,International Journal of Futures Research and Development,
10.46627,SI - Scientific Online Journal,
10.46628,"Artuklu Human and Social Science Journal, Mardin Artuklu University",
10.46635,REVISE - Revista Integrativa de Inovacao Tecnologica nas Ciencias da Saude,
10.46636,Instituto Federal do Norte de Minas Gerais,
10.46755,Vietnam Association of Obstetrics and Gynecology - VAGO,
10.46642,Lecturas: Educacion Fisica y Deportes,
10.52539,Istanbul Medeniyet University,
10.46641,Istanbul Medeniyet University,
10.46640,Center for Philosophy of Media and Media Research,
10.46639,The Donghak Society,
10.46644,DNIPROPETROVSK RESEARCH INSTITUTE OF FORENSIC EXAMINATIONS,
10.46637,Southeast Asia Mental Health and Counseling Association,
10.46646,International Sakharov Environmental Institute of Belarusian State University,
10.46643,Perkumpulan Doktor Indonesia Maju,
10.46638,Perhimpunan Mikologi Indonesia (Mikoina),
10.46647,International Journal of Engineering Technology and Management Sciences,
10.46649,"Al-Furat Journal of Innovations in Electronics and Computer Engineering, ATU",
10.46948,Global Science Research Journals,
10.46757,Sekolah Tinggi Ilmu Ekonomi PGRI Sukabumi,
10.46709,Ohio Public Health Association,
10.46716,International Society for the Study of Trauma and Dissociation,
10.22514,MRE Press,
10.46712,Carolina Small Business Development Fund,
10.46721,Fundacion para la Educacion y Calidad en Investigacion Medica Ecuatoriana (FECIM-ECUADOR),
10.46754,"Penerbit UMT, Universiti Malaysia Terengganu",
10.46655,Fe Journal,
10.46722,Al-Hikmah Research and Publication Center,
10.46697,Academy of International Business,
10.46690,Yandy Scientific Press,
10.46668,STIKes Panti Rapih Yogyakarta,
10.46664,Sociedade Paulista de Radiologia e Diagnostico por Imagem,
10.46718,Open Access Journal of Biogeneric Science and Research,
10.46951,Pennsylvania Association for Colleges and Teacher Educators,
10.46860,"Chandigarh Group of Colleges, Mohali",
10.46666,Kazakh Research Institute of Economy of Agro-Industrial Complex and Rural Development,
10.46667,Revista de Ensino de Biologia,
10.46665,The Association of Korean Economic Studies,
10.46830,World Resources Institute,
10.46720,FISITA,
10.46669,Korea Sport Society,
10.46715,SkepticMed Publishers,
10.46675,Revista Brasileira de Ciencias Biomedicas,
10.46676,"International Journal on Food, Agriculture, and Natural Resources (IJFANRES), Jember University",
10.46671,UFM Madrid,
10.46723,Endless Science Ltd,
10.46674,Bulletin of Sudanese Studies,
10.47957,South Asian Academic Publications,
10.37022,South Asian Academic Publications,
10.38022,South Asian Academic Publications,
10.46796,South Asian Academic Publications,
10.46956,South Asian Academic Publications,
10.46797,South Asian Academic Publications,
10.46795,South Asian Academic Publications,
10.46673,Adab,
10.46672,Libertas medunarodno sveuciliste,
10.53932,Consejo de Formacion en Educacion,
10.46681,Consejo de Formacion en Educacion,
10.46680,Himpunan Pengembang Kurikulum Indonesia Wilayah Jawa Tengah,
10.46747,The College of Family Physicians of Canada,
10.46687,Konstantin Preslavsky University of Shumen,
10.46688,Archivos de historia del movimiento obrero y la izquierda,
10.46767,Kenan Fellows Program for Teacher Leadership,
10.46679,CSMFL Publications,
10.46684,Educational and Instructional Center for Railway Transportation,
10.46683,Journal of Molecular Virology and Immunology,
10.46682,IJHBS Publication,
10.46689,Joint-Stock Company - Yuzhuralzoloto Group Of Companies,
10.46826,"University of Agriculture and Forestry, Hue University",
10.46696,REVISTA AFRICA E AFRICANIDADES,
10.46695,Asian Society for Sport Convergence Sciences,
10.46939,Valahia University of Targoviste - Journal of Science and Arts,
10.46694,Korean Association of Slavic-Eurasian Studies,
10.46693,National Remote Sensing Centre,
10.46851,INDEF - Institute for Development of Economics and Finance,
10.46698,Vladikavkaz Scientific Centre of the Russian Academy of Sciences,
10.23671,Vladikavkaz Scientific Centre of the Russian Academy of Sciences,
10.46699,Fundacao Universitaria do Desenvolvimento do Oeste Fundeste,
10.46744,Academia Peruana de la Lengua,
10.46794,Universidad Nacional Hermilio Valdizan - Escuela de Posgrado,
10.46831,The Association of Pediatric Surgeons of Pakistan,
10.3289,GEOMAR Helmholtz Centre for Ocean Research Kiel,
10.46853,The European Association of Counselling Psychology,
10.47740,University for Development Studies Library,
10.54106,University for Development Studies Library,
10.47762,University for Development Studies Library,
10.47881,University for Development Studies Library,
10.20659,Japan Society of Forest Planning,
10.46700,Asiatic Society for Social Science Research,
10.46703,Fakultas Kehutanan Universitas Papua,
10.46706,Sociedad de Psiquiatria del Uruguay,
10.46705,Federation of Sport Pedagogues of Republic of Macedonia,
10.46702,Jurnal Ilmu Kepolisian,
10.46701,Blood and Genomics,
10.46704,Krishma Educational Centre,
10.46707,University of Birmingham Library Services,
10.32398,"California State University, Office of the Chancellor",
10.46787,"California State University, Office of the Chancellor",
10.52232,Denpasar Institute,
10.46769,"Centre for Democracy, Research and Development (CEDRED)",
10.46788,Medical Practice Scientific Society,
10.46785,Centro Internacional de Investigacion y Desarrollo (CIID),
10.47241,Centro Internacional de Investigacion y Desarrollo (CIID),
10.47120,National Physical Laboratory,
10.46805,"Dogma, Philosophy and Human Sciences Review",
10.46861,Bulletin Mineralogie Petrologie,
10.46736,Eurasian Scientific and Medical Journal Sino,
10.46784,Scientific Veterinary Institute 'Novi Sad',
10.46786,Philosophy of Education Society of Australasia,
10.46882,International Scholars Journals,
10.46735,Instituto Andaluz de Administracion Publica,
10.46732,Acta Fisheries and Aquatic Resources (ActaPesca News),
10.46731,Relicario: Revista do MAS,
10.46729,Inara,
10.46734,Centro de Investigacion de la Sociedad del Conocimiento,
10.46730,"Jurnal Administrasi Politik dan Sosial, Fakultas Ilmu Sosial dan Ilmu Politik Universitas Riau",
10.46739,Debreceni Reformatus Hittudomanyi Egyetem,
10.46740,"ALKU Fen Bilimleri Dergisi, Alanya Alaaddin Keykubat University",
10.46737,Ekonomi Maliye Isletme Dergisi,
10.46738,"The Korean Association for Laser, Dermatology and Trichology",
10.46742,Institute of Developmental Physiology RAE,
10.46741,Vologda Institute of Law and Economics of the Federal Penal Service of Russia,
10.46829,University of Ghana,
10.47102,"Academy of Medicine, Singapore",
10.46748,Iskusstvo Evrazii,
10.46750,"Jurnal Economica, ISEI Cabang Pekanbaru",
10.46749,AKPER Fatmawati,
10.18549,JCFCorp SG PTE LTD,
10.18001,JCFCorp SG PTE LTD,
10.1900,JCFCorp SG PTE LTD,
10.17628,JCFCorp SG PTE LTD,
10.46751,National Public Law Review,
10.46753,Poincare Publishers,
10.46752,Associacao Nacional de Pesquisadores e Professores de Historia das Americas (ANPHLAC),
10.46792,"Faculty of Engineering, Federal University Oye-Ekiti",
10.46763,Goce Delchev University - Shtip,
10.46765,Journal of Bone Marrow Transplantation and Cellular Therapy,
10.46762,Maarif Mektepleri-International Journal of Educational Sciences,
10.46758,Korean Law and Economics Association,
10.46759,Irish Interdisciplinary Journal of Science and Research,
10.46761,Revista Cientifica da Faculdade de Balsas,
10.46852,Agricultural Economics and Social Science Research Association (AESSRA),
10.46760,The Jungbu Archaeological Society,
10.46782,Belarus State Economic University,
10.46858,"Dr. Vithalrao Vikhe Patil Foundation, Ahmednagar",
10.46884,Aeres Hogeschool,
10.46828,Ocean Publication,
10.46776,"Journal of Arts Entrepreneurship Education, University of Memphis",
10.46779,"University of Bihac, Faculty of Economics",
10.46775,Institute of Global Business Research,
10.46778,Gaziosmanpasa University,
10.54187,Gaziosmanpasa University,
10.53570,Gaziosmanpasa University,
10.46780,Centro Universitario de Zacapa,
10.46777,"Prodi Pendidikan Agama Kristen, FKIP, Universitas Kristen Indonesia",
10.46781,STAI Diniyah Pekanbaru,
10.46773,STAI Muhammadiyah Probolinggo,
10.46774,"Journal of Publikasi Penelitian Terapan dan Kebijakan, Balitbangda Sumatera Selatan",
10.46772,Universitas Muhadi Setiabudi,
10.46783,Electronic Scientific Journal Intellectualization of Logistics and Supply Chain Management,
10.47206,International Universities Strength and Conditioning Association,
10.48216,SCIO Publishing,
10.46790,"Erzincan Universitesi Sosyal Bilimler Enstitusu Dergisi, Erzincan Binali Yuldurum Universitesi",
10.46789,Revista Brasileira de Educacao em Geografia,
10.46791,Unique Journals Communication,
10.46827,Open Access Publishing Group,
10.46803,"Ibtida Journal of Elementary School, Sekolah Tinggi Agama Islam Nahdlatul Ulama Kotabumi Lampung",
10.46800,"Jurnal Ilmu Bedah Indonesia, Universitas Indonesia",
10.46798,Indian Association of Applied Microbiologists (IAAM),
10.46802,Revista Movimentos Sociais e Dinamicas Espaciais,
10.46799,Ridwan Institute,
10.46801,Instituto Brasileiro de Direito Tributario,
10.46859,Faculdades Catolicas - Departamento de Teologia,
10.46855,Applied Energy Innovation Institute (AEii),
10.46857,University of Toamasina,
10.46856,Pan American League of Associations of Rheumatology (PANLAR),
10.46807,Pusat Penelitian Badan Keahlian Sekretariat Jenderal DPR RI,
10.46809,Global Talent Academy,
10.46808,Politeknik Indonusa Surakarta,
10.46806,Institut Bisnis dan Informatika Kwik Kian Gie,
10.46811,Academy of Health Professionals,
10.46810,"Turk Doga ve Fen Dergisi, Bingol University",
10.46889,Athenaeum Scientific Publishers,
10.51221,University of South Carolina Libraries,
10.47790,Instituto de Estudios Turolenses,
10.46913,NNC Institute of Beekeeping named after P.I. Prokopovich,
10.46813,Problems of Atomic Science and Technology,
10.46812,Revista Agora,
10.47101,Sociedad Espanola de Historia de las Ciencias y las Tecnicas,
10.46816,Asosiasi Pengajar Hukum Adat Indonesia,
10.46815,Akademi Keperawatan Ngesti Waluyo Temanggung,
10.46817,Sekolah Tinggi Teologi Kalimantan,
10.46818,Centro de Estudos Juridicos da Procuradoria Geral do Estado do Rio de Janeiro,
10.46819,Tanc es Neveles,
10.46887,Northwest Territories Geological Survey,
10.32028,Archaeopress Publishing Ltd,
10.47486,Australian Research Data Commons (ARDC),
10.46821,Universitas Bhayangkara Surabaya,
10.54732,Universitas Bhayangkara Surabaya,
10.46822,STKIP Muhammadiyah Sampit,
10.46824,GAW Bukit Kototabang - Badan Meteorologi Klimatologi dan Geofisika,
10.46823,Institute for Historical Studies at Chung-Ang University,
10.46832,Journal of Mines Metals and Fuels,
10.46833,Revista Paulista de Reumatologia,
10.47536,International Whaling Commission,
10.46990,Invepy y Asociados S.C.,
10.46885,Nucleo de Desenvolvimento dos Tecnicos de Radiologia,
10.47190,Universidad Nacional de Juliaca,
10.46841,Institutul de Cercetare a Calitatii Vieti,
10.46839,Sekolah Tinggi Ilmu Hukum Sumpah Pemuda Palembang,
10.46834,Association of Korean Modern and Contemporary Art History,
10.46842,"Cientifica, Revista Mexicana de Ingenieria Electromecanica y de Sistemas, IPN",
10.46836,Arsip Nasional Republik Indonesia,
10.46837,Politeknik Internasional Bali,
10.46844,BLITHE Research Initiative,
10.46843,Yayasan Keluarga Guru Mandiri,
10.46845,Kaliningrad State Technical University,
10.46835,Seoul Institute of Economic Research,
10.46838,MAN Insan Cendekia Jambi,
10.46840,"Centro de diseno, cine y television",
10.46846,Politeknik Meta Industri Cikarang,
10.46847,Ukrainian Military Medical Academy,
10.46848,Revista Teorico-Pratico,
10.46849,"Journal of Economics and Administrative Sciences, Giresun University",
10.46993,Mohammed Bin Rashid School of Government,
10.46944,ASP Editions,
10.46950,The Representative Office of the Institute for War and Peace Reporting in Kyrgyzstan,
10.47152,Institute of Criminological and Sociological Research,
10.46988,Gulf University,
10.46865,ISOASPSH of N.D. Kondratieff,
10.46862,Fakultas Kedokteran Gigi Universitas Mahasaraswati Denpasar,
10.46864,Joint Institute of Mechanical Engineering of the National Academy of Sciences of Belarus,
10.13141,"Sachsische Landesbibliothek, Staats- und Universitatsbibliothek Dresden",
10.25372,"Sachsische Landesbibliothek, Staats- und Universitatsbibliothek Dresden",
10.34647,"Sachsische Landesbibliothek, Staats- und Universitatsbibliothek Dresden",
10.52413,"Sachsische Landesbibliothek, Staats- und Universitatsbibliothek Dresden",
10.25367,"Sachsische Landesbibliothek, Staats- und Universitatsbibliothek Dresden",
10.25366,"Sachsische Landesbibliothek, Staats- und Universitatsbibliothek Dresden",
10.52412,"Sachsische Landesbibliothek, Staats- und Universitatsbibliothek Dresden",
10.52411,"Sachsische Landesbibliothek, Staats- und Universitatsbibliothek Dresden",
10.52414,"Sachsische Landesbibliothek, Staats- und Universitatsbibliothek Dresden",
10.25368,"Sachsische Landesbibliothek, Staats- und Universitatsbibliothek Dresden",
10.25531,"Sachsische Landesbibliothek, Staats- und Universitatsbibliothek Dresden",
10.52410,"Sachsische Landesbibliothek, Staats- und Universitatsbibliothek Dresden",
10.25371,"Sachsische Landesbibliothek, Staats- und Universitatsbibliothek Dresden",
10.25370,"Sachsische Landesbibliothek, Staats- und Universitatsbibliothek Dresden",
10.25369,"Sachsische Landesbibliothek, Staats- und Universitatsbibliothek Dresden",
10.46892,Achieve Behavioral Health,
10.46886,Knowledge Words Publications,
10.46909,University of Life Sciences in Iasi,
10.46866,"Journal of Social Sciences, Humanities and Research in Education (JOSSHE)",
10.46949,Heyttu,
10.47119,International Journal of Research Publications,
10.47832,Rimar Academy Egitim Arastirma ve Danismanlik Limited Sirketi,
10.46945,Bangladesh Physiotherapy Association (BPA),
10.53562,Turtle Conservation and Research Programme Foundation,
10.46914,Turan University,
10.46910,American Bilingual University,
10.46912,Cprint Publishers (CPP),
10.46997,Sociedad Medica Ecuatoriana de Neurologia,
10.46873,Głowny Instytut Gornictwa (Central Mining Institute),
10.46870,STAIN Majene,
10.46869,The State Institution - Institute of World History of the National Academy of Sciences of Ukraine,
10.46871,Gaziantep Islam Science and Technology University,
10.46868,Akademik Tarih ve Dusunce Dergisi,
10.46874,Komisi Pemilihan Umum Republik Indonesia,
10.46875,Faculdade do Centro Oeste Paulista,
10.46877,Mecila Working Papers Series,
10.46879,Institute for Medical Radiology and Oncology of NAMS of Ukraine,
10.46876,Journal of Agriculture,
10.46880,"METHOMIKA:Jurnala Manajemen Informatika dan Komputerisasi Akuntansi, Universitas Methodist Indonesia",
10.46898,Rfb Editora,
10.47051,Tropical Herping,
10.46915,Zero Prod. Ltd. Sti.,
10.46947,Jamal Mohamed College,
10.46890,Science Letters,
10.46894,The Korean Association for Immigration Policy and Administration,
10.46893,UYEP Merkezi,
10.46896,Journal of Islamic Civilization and Culture,
10.46897,Uluslararasi hayvancilik arastirma ve egitim merkezi mudurlugu Livestock Studies dergisi,
10.46895,Mita Society for Library and Information Science,
10.47234,Sociedad Matematica Mexicana A.C.,
10.47186,Universidad Privada de Huancayo Franklin Roosevelt,
10.54121,Dasson Publication,
10.46903,Gomal Journal of Medical Sciences,
10.46902,Folha de Rosto: Revista de Biblioteconomia e Ciencia da Informacao,
10.46899,"Jurnal Ekonomi Dan Perbankan Syariah, STEI SEBI",
10.46900,Archives of Pediatric Neurosurgery,
10.46904,Editura Electra,
10.46901,Defensoria Publica da Uniao,
10.46906,CAOS Revista Eletronica de Ciencias Sociais,
10.46907,"Social Integration Research Center, Kangwon National University",
10.47050,Fundacja Rozwoju Systemu Edukacji,
10.47081,Neuroscience Society of Nigeria,
10.46918,Universitas Muslim Maros,
10.46917,VERN University,
10.47082,European University Foundation,
10.46920,Russian Energy Agency,
10.52815,Russian Energy Agency,
10.47010,The Russian Journal of Cognitive Science,
