10.37790,Eotvos Lorand University (ELTE),
10.35744,Eotvos Lorand University (ELTE),
10.38143,Eotvos Lorand University (ELTE),
10.21862,Eotvos Lorand University (ELTE),
10.36427,Eotvos Lorand University (ELTE),
10.24029,Eotvos Lorand University (ELTE),
10.38144,Eotvos Lorand University (ELTE),
10.37775,Eotvos Lorand University (ELTE),
10.54310,Eotvos Lorand University (ELTE),
10.47074,Eotvos Lorand University (ELTE),
10.37205,Eotvos Lorand University (ELTE),
10.37587,Eotvos Lorand University (ELTE),
10.54148,Eotvos Lorand University (ELTE),
10.48007,Eotvos Lorand University (ELTE),
10.26888,Eotvos Lorand University (ELTE),
10.38210,Eotvos Lorand University (ELTE),
10.26830,Eotvos Lorand University (ELTE),
10.23879,Eotvos Lorand University (ELTE),
10.37588,Eotvos Lorand University (ELTE),
10.17668,Eotvos Lorand University (ELTE),
10.30921,Eotvos Lorand University (ELTE),
10.30866,Eotvos Lorand University (ELTE),
10.31074,Eotvos Lorand University (ELTE),
10.52092,Eotvos Lorand University (ELTE),
10.51687,Eotvos Lorand University (ELTE),
10.53720,Eotvos Lorand University (ELTE),
10.37584,Eotvos Lorand University (ELTE),
10.47075,Eotvos Lorand University (ELTE),
10.51139,Eotvos Lorand University (ELTE),
10.55052,Eotvos Lorand University (ELTE),
10.31852,Eotvos Lorand University (ELTE),
10.31400,Eotvos Lorand University (ELTE),
10.52656,Eotvos Lorand University (ELTE),
10.29285,Eotvos Lorand University (ELTE),
10.21861,"University of Zagreb, Department of Geography",
10.21860,"University of Rijeka, Faculty of Medicine",
10.21865,Associacao Iberoamericana de Diagnostico e Avaliacao Psicologica,
10.21864,British Global Travel Health Association (BGTHA),
10.21866,Academy of East Asian Studies,
10.21869,Southwest State University,
10.21871,Journal of Franchise Management,
10.21870,National Medical Research Radiological Centre,
10.21863,Publishing India Group,
10.21872,Institute of Industrial and Systems Engineers,
10.21873,Anticancer Research USA Inc.,
10.21878,Associacao Brasileira de Pesquisadores em Comunicacao e Politica (Compolitica),
10.21877,Revista Brasileira de Analises Clinicas,
10.21875,Programa de Pos Graduacao em Direito da Universidade Federal do Rio de Janeiro,
10.21880,Revista IUS GENTIUM,
10.21874,Escola Nacional de Administracao Publica (ENAP),
10.21882,Revista Uninter de Comunicacao,
10.21876,Revista Ciencias em Saude,
10.21881,Abril NEPA UFF,
10.21879,Revista da FAEEBA,
10.21883,Ioffe Institute Russian Academy of Sciences,
10.21884,International Journal of Modern Trends in Engineering and Research,
10.21886,Rostov State Medical University,
10.21885,West Virginia State Medical Association (WVSMA),
10.21887,Society for Veterinary Science and Biotechnology,
10.21888,Korean Association of Government Studies,
10.21889,Tokyo University of Science,
10.21890,International Journal of Research in Education and Science,
10.21892,Corporacion Universitaria del Caribe - CECAR,
10.21891,"Journal of Education in Science, Environment and Health",
10.21893,Scientific World Ltd.,
10.21895,Universidad Catolica Los Angeles de Chimbote,
10.21894,Malaysian Palm Oil Board,
10.21896,The Korean Society of Maternal and Child Health,
10.21898,Dianoia Revista de Filosofia,
10.21897,Universidad de Cordoba,
10.21899,First Edition Design Publishing,
10.21901,Instituto Junguiano de Sao Paulo (IJUSP),
10.21904,We Ken,
10.21903,Akademik Bakis Uluslararasi Hakemli Sosyal Bilimler E-Dergisi,
10.53757,University of Illinois Main Library,
10.21900,University of Illinois Main Library,
10.21902,International Journal of Professional Business Review,
10.21910,Revista Brasileira de Sociologia do Direito,
10.21912,Africa's Public Service Delivery and Performance Review,
10.21909,Institute of Experimental Psychology,
10.21908,SIRIM Industrial Research,
10.21911,Turkish National Society of Allergy and Clinical Immunology,
10.21907,"Roman House Productions, Ltd.",
10.21906,Polskie Towarzystwo Teologiczne Sekcja Wydawnicza,
10.21905,Bindura University of Science Education,
10.21913,University of South Australia Library,
10.21915,"Institute of Mathematics, Academia Sinica",
10.21914,"Australian Mathematical Publishing Association, Inc.",
10.21916,Bureau of Labor Statistics,
10.21917,ICT Academy,
10.21919,"Instituto Mexicano de Ejecutivos de Finanzas, A.C. (IMEF)",
10.1609,Association for the Advancement of Artificial Intelligence (AAAI),
10.21918,Association for the Advancement of Artificial Intelligence (AAAI),
10.18130,University of Virginia,
10.21920,Revista Eletronica Cientifica Ensino Interdisciplinar,
10.21931,Clinical Biotec,
10.21925,Minneapolis Heart Institute Foundation,
10.21926,LIDSEN Publishing Inc,
10.21923,Muhendislik Bilimleri ve Tasarim Dergisi,
10.21927,Alma Ata University Press,
10.21933,ENES Unidad Leon UNAM,
10.21928,University of Human Development,
10.22135,Graduate Program Sriwijaya University,
10.22134,Trace (Travaux et Recherches dans les Ameriques du Centre),
10.21930,Corporacion Colombiana de Investigacion Agropecuaria (Corpoica),
10.21922,Scholarly Research Journals,
10.37114,Abanico,
10.21929,Abanico,
10.21924,Komunitas Ilmuwan dan Profesional Muslim Indonesia (KIPMI),
10.21932,SACCoM - Sociedad Argentina para las Ciencias Cognitivas de la Musica,
10.22136,"El Colegio Mexiquense, A. C.",
10.22137,Central Luzon State University International Affairs Office,
10.22140,Rutgers University - Newark School of Public Affairs and Administration,
10.22145,The Australian National University,
10.22143,Asia Culture Academy of Incorporated Association,
10.22139,The Journal of Business Science,
10.22141,Publishing House Zaslavsky,
10.22142,Institute of International Trade,
10.22144,Can Tho University,
10.22148,CA: Journal of Cultural Analytics,
10.22138,Bulletin of the Ural Medical Academie Science,
10.22147,Ansari Education and Research Society,
10.22146,Universitas Gadjah Mada,
10.22151,International Association for Political Science Students,
10.22150,SlaveFree Today,
10.22149,EEEIC International Publishing,
10.22152,Aspect-Oriented Software Association (AOSA),
10.22153,Al-Khwarizmi Engineering Journal,
10.22154,Korean Society of Children's Literature and Education,
10.22155,Association for Future Early Childhood Education,
10.22158,"Scholink Co, Ltd.",
10.22162,Kalmyk Institute for Humanities of the RAS,
10.22161,AI Publications,
10.22159,Innovare Academic Sciences Pvt Ltd,
10.22157,GDG,
10.22156,Convergence Society for SMB,
10.22160,African Studies Association of Australasia and the Pacific (AFSAAP),
10.22163,Austrian Platform for Research and Technology Policy Evaluation (FTEVAL),
10.22164,Indonesian Center for Social and Environmental Accounting Research and Development (ICSEARD),
10.22170,Ciencia e Cultura,
10.22166,Revista Dissertatio de Filosofia,
10.22172,Korean Society For Cognitive and Biological Psychology,
10.22173,Korean Society for the Sociology of Sport,
10.22165,Revista Enfermagem Atual In Derme,
10.22174,Institute of Communication Research,
10.22167,I-PECEGE,
10.22169,Revista Intersaberes,
10.22168,Programa de Extensao TEIA Entrepalavras,
10.22171,Revista de Estudos Juridicos UNESP,
10.22176,MayDay Group,
10.22177,Pavilion Publications,
10.22179,Museo Argentino de Ciencia Naturales,
10.22178,Publishing Center Dialog,
10.22184,Technosphera JSC,
10.22180,Nano Advances Publishing Office,
10.22181,APESB - Associacao Portuguesa de Engenharia Sanitaria e Ambeintal,
10.22182,Institute for Political Studies,
10.22185,Papeles de Poblacion,
10.22183,Research Nebula,
10.22186,Journal of Young Investigators,
10.22190,University of Nis,
10.22189,National Association of Directors of Nursing Administration in Long Term Care,
10.22188,Makadam,
10.22187,Revista de la Facultad de Derecho,
10.22193,"Instituto Mexicano del Cemento y del Concreto, A.C.",
10.22194,Journal of Global Innovations in Agricultural and Social Sciences (JGIASS),
10.22192,Darshan Publishers,
10.22191,Binghamton University,
10.22195,Revista Educacao em Foco (UFJF),
10.22196,Revista Pedagogica,
10.22197,Instituto Brasileiro de Direito Processual Penal,
10.22198,"Region y Sociedad, Revista de el Colegio de Sonora",
10.22204,Russian Foundation for Basic Research,
10.22202,STKIP PGRI Sumatera Barat,
10.22200,Pakistan Journal of Pharmaceutical Research,
10.22205,South Indian Journal of Biological Sciences,
10.22203,European Cells and Materials,
10.22201,Universidad Nacional Autonoma de Mexico,
10.37568,Universidad Nacional Autonoma de Mexico,
10.22199,Universidad Catolica del Norte - Chile,
10.22211,Lukasiewicz Research Network - Institute of Industrial Organic Chemistry,
10.22213,Kalashnikov Izhevsk State Technical University,
10.22208,Journal of Dentomaxillofacial Science,
10.22206,Instituto Tecnologico de Santo Domingo (INTEC),
10.22210,Hrvatsko filolosko drustvo (Croatian Philological Society),
10.22207,Journal of Pure and Applied Microbiology,
10.22212,Journal of Economic and Public Policy,
10.22214,International Journal for Research in Applied Science and Engineering Technology (IJRASET),
10.22216,Lembaga Layanan Pendidikan Tinggi - LLDIKTI -  Wilayah X,
10.22209,Corporacion Universitaria Remington,
10.22215,Carleton University,
10.22217,Urban Planning International,
10.22226,Institute for Metals Superplasticity Problems of RAS,
10.22219,Universitas Muhammadiyah Malang,
10.22218,Cairo Center for Development Benchmarking,
10.22224,University Consortium for Geographic Information Science (UCGIS),
10.22221,Climate Modelling Laboratory,
10.22220,"Physiology and Medicine Publishing, Pte. Ltd.",
10.22227,Moscow State University of Civil Engineering,
10.22228,Revista Territorios e Fronteiras,
10.22229,Ohio Counseling Association,
10.22230,CISP Journal Services,
10.22235,Universidad Catolica de Uruguay,
10.22233,British Small Animal Veterinary Association,
10.22232,Mizoram University,
10.22234,Culturales,
10.22236,University of Muhammadiyah Prof. Hamka (UHAMKA),
10.22237,Wayne State University Library System,
10.22239,"Vigilancia Sanitaria em Debate: Sociedade, Ciencia y Tecnologia",
10.22238,Revista Cerrados,
10.22248,International University of Japan,
10.22246,The Society of Internal Korean Medicine,
10.22244,Indian Association for Angiosperm Taxonomy (IAAT),
10.22243,Korean Academy of Leadership,
10.22245,The Korean Academy of New Religions,
10.36138,Edra SpA,
10.30435,Edra SpA,
10.23822,Edra SpA,
10.36130,Edra SpA,
10.32098,Edra SpA,
10.36118,Edra SpA,
10.36164,Edra SpA,
10.36129,Edra SpA,
10.19256,Edra SpA,
10.48286,Edra SpA,
10.22241,Revista Tocantinense de Geografia,
10.22242,The Korea Social Welfare Research Institute,
10.22247,EverScience Publications,
10.22249,Institute for the Future of Higher Education in Kyung Hee Cyber University,
10.22251,Korean Association For Learner-Centered Curriculum And Instruction,
10.22250,Amur State University,
10.22256,PUBVET,
10.22254,Church History Society in Korea,
10.22253,The Korean Society for Seon Studies,
10.22255,Korean Association for Buddhist Studies,
10.22257,Korean Psychological Association,
10.22261,Veruscript,
10.22262,The Open University of Israel,
10.22260,International Association for Automation and Robotics in Construction (IAARC),
10.22258,Asociacion Civil Universidad de Ciencias y Humanidades,
10.22259,Sryahwa Publications,
10.22264,CLIO: Revista de Pesquisa Historica,
10.22266,The Intelligent Networks and Systems Society,
10.22265,Asociacion Colombiana de Nefrologia e Hipertension Arterial,
10.22267,Universidad de Narino,
10.22271,AkiNik Publications,
10.22355,Associacao Portuguesa de Estudos sobre as Mulheres - APEM,
10.22269,Places Journal,
10.22268,Arab Society for Plant Protection,
10.22270,Society of Pharmaceutical Tecnocrats,
10.22285,The Korean Society of Emergency Medical Services,
10.22281,Bryansk State University,
10.22275,Global English Teachers Association,
10.22272,Korean Nietzsche Society,
10.22280,Revinter,
10.22284,The Academy of Qualitative Research,
10.22277,Revista Gestao Organizacional,
10.22286,Korean Association of Legal Philosophy,
10.22274,The Society of Korean Oral Literature,
10.22283,Institute of Natural Science,
10.22278,Secretaria da Saude do Estado da Bahia,
10.22276,Ethnoscientia,
10.22279,Servico Nacional de Aprendizagem Comercial / SENAC SC,
10.22273,The Society of Modern Literary Theory,
10.22293,Faculdade Damas da Instrucao Crista,
10.22294,Departamento de Educacao UFV,
10.22282,The Online Journal of Recreation and Sport,
10.22297,Dialogo das Letras,
10.22290,Jornal Brasileiro de Neurocirurgia,
10.22298,Revista Fisisenectus,
10.22291,Associacao Brasileira de Cefaleia,
10.22289,Psicologia e Saude em Debate,
10.22296,Revista Brasileira de Estudos Urbanos e Regionais (RBEUR),
10.22288,Federacao Brasileira de Gastroenterologia,
10.22292,Revista Meio Ambiente e Sustentabilidade,
10.22287,Revistas Integradas Campos Salles,
10.22301,IJHMCR ( International Journal Of Health Medicine and Current Research ),
10.20935,Academia.edu,
10.22302,Riset Perkebunan Nusantara,
10.22299,Khon Kaen University,
10.22303,University of Potensi Utama Medan,
10.22304,Padjadjaran Jurnal Ilmu Hukum,
10.22300,American Real Estate Society,
10.22307,Edicions UIB,
10.22306,"4S go, s.r.o.",
10.22308,AWSELVA,
10.22310,Cadernos de Pos-Graduacao em Disturbios do Desenvolvimento,
10.22313,Residential Environment Institute Of Korea,
10.22311,Medina Publishing Ltd.,
10.22314,FSBI All Russian Research Institute for Mechanization in Agriculture (VIM),
10.22309,Pedagogiatorteneti Szemle,
10.22312,SDU Journal of Health Sciences,
10.22321,Korea Distribution and Logistics Policy Association,
10.22320,Universidad del Bio Bio,
10.22316,Philosophy of Coaching,
10.22324,"The International Journal of Human Resource Development: Practice, Policy and Research",
10.22322,Center for Handicraft and Batik,
10.22318,International Society of the Learning Sciences,
10.22317,Naba'a Al-Hayat Foundation for Medical Sciences and Health Care,
10.22323,Sissa Medialab Srl,
10.22319,Revista Mexicana de Ciencias Pecuarias,
10.22325,Federacion Espanola de Sociologia,
10.22333,Center for Civil Integration and Inter-Ethnic Relations,
10.22335,Policia Nacional de Colombia,
10.22330,International Society for Human Ethology (ISHE),
10.22336,Fundatia Universitara Sanabuna,
10.22332,Center for the Study of Material and Visual Cultures of Religion,
10.22337,Publishing House ASV (Izdatelstvo ASV),
10.22326,International Journal of Anatolia Sport Sciences,
10.22331,Verein zur Forderung des Open Access Publizierens in den Quantenwissenschaften,
10.22338,Andalas University,
10.22328,Baltic Medical Education Center,
10.22327,The Research Institute of Korean Education,
10.22329,University of Windsor Leddy Library,
10.22339,International Big History Association,
10.22340,Chungbuk National University Social Science Institute,
10.22341,JACSOnline Group Publisher,
10.22334,JBHOST Journal of Business on Hospitality and Tourism,
10.22343,Gorodets,
10.22342,Indonesian Mathematical Society,
10.21112,"R.W. Steen Library, SFASU",
10.22344,Hankuk University of Foreign Studies Literature Studies,
10.22346,The Korean Association for Religious Education,
10.22348,Revista Internacional de Educacao Superior,
10.22351,Faculdades EST,
10.22350,Editora Fi,
10.22347,Revista Meta - Avaliacao,
10.22345,Korean Society for Urban History,
10.22349,FSUE CRISM Prometey,
10.22353,National University of Mongolia,
10.22352,Universidad de Magallanes,
10.22354,Asociacion Colombiana de Infectologia - ACIN,
10.21428,PubPub,
10.22356,Flinders University Library,
10.22358,"The Kielanowski Institute of Animal Physiology and Nutrition, PAS",
10.22357,Rochester Cathedral Research Guild,
10.22361,Journal of Facility Management Education and Research,
10.22359,Journal of Clinical Social Work and Health Intervention,
10.22360,Society for Modeling and Simulation International (SCS),
10.21851,The Oral Biology Research Institute at Chosum University,
10.22362,IJCERT Publication House,
10.21921,Society for Upliftment of Rural Economy (SURE),
10.22225,Universitas Warmadewa,
10.22369,"The Shodor Education Foundation, Inc.",
10.22364,University of Latvia,
10.22363,Peoples' Friendship University of Russia,
10.22371,University of San Diego - Copley Library,
10.22370,Universidad de Valparaiso Chile,
10.22368,The Korea Society of Energy and Climate Change Education,
10.22366,Nigerian Young Academy,
10.22373,Universitas Islam Negeri Ar-Raniry,
10.22372,Center for Korean History,
10.22367,University of Economics in Katowice,
10.22365,Hellenic Psychiatric Association,
10.22374,"Dougmar Publishing Group, Inc.",
10.22377,BRNSS Publication Hub,
10.22378,Sh.Marjani Institute of History of Tatarstan Academy of Sciences,
10.22376,International Journal of Pharma and Bio Sciences,
10.22379,Asociacion Colombiana de Neurologia,
10.22382,Society of Wood Science and Technology,
10.22383,Universidad Catolica de Manizales,
10.22385,"Journal of Communications Technology, Electronics and Computer Science (JCTECS)",
10.22381,Addleton Academic Publishers,
10.22384,Hyperion University,
10.22386,Universidad Cientifica del Peru,
10.22380,Instituto Colombiano de Antropologia e Historia (ICANH),
10.22387,Capacious: The Journal for Emerging Affect Inquiry,
10.22396,Marmara Universitesi Spor Bilimleri Dergisi,
10.21590,MRI Books,
10.22391,Family Practice and Palliative Care,
10.22295,Revista Grifos,
10.21605,Cukurova Universitesi Muhendislik-Mimarlik Fakultesi Dergisi,
10.22394,The Russian Presidential Academy of National Economy and Public Administration,
10.21589,Legal Research Institute of Ajou University,
10.22393,Barcaray Publishing Limited,
10.22305,Universidad Nacional de la Patagonia Austral,
10.22390,"Institute of Public Administration and Management, Russian Academy of National Economy and Public Administration (IPAM RANEPA)",
10.22392,Suleyman Demirel Universitesi Egirdir Su Urunleri Fakultesi Dergisi,
10.22388,Departamento de Psicobiologia - UNIFESP,
10.22399,International Journal of Computational and Experimental Science and Engineering (IJCESEN),
10.22397,Wonkwang University Legal Research Institute,
10.22398,ESPM Rio de Janeiro,
10.22389,"FSBI Center of Geodesy, Cartography, and SDI",
10.22395,Universidad de Medellin,
10.21418,UC Berkeley Geotechnical Engineering Research,
10.22400,Consejo de la Juventud de Extremadura,
10.22401,Al-Nahrain Journal of Science,
10.22402,UNAM Facultad de Estudios Superiores Iztacala,
10.22405,FSBEIHE Tula State Lev Tolstoy Pedagogical University,
10.22403,Universidad de Quintana Roo,
10.22404,ISTEM,
10.22410,Editora Univates,
10.22411,REDE – Revista Eletronica do PRODEMA,
10.22406,Science and Business Publishing UK Ltd.,
10.22409,"Pro Reitoria de Pesquisa, Pos Graduacao e Inovacao - UFF",
10.22408,Instituto de Cultura Tecnica Sociedade Civil Ltda,
10.22407,Instituto Federal de Educacao Ciencia e Tecnologia do Rio de Janeiro - IFRJ,
10.22422,Revista Temporalis,
10.22417,"The Institute for Social Science Research, Kyungpook National University",
10.22416,Russian Gastroenterolgocial Society,
10.22415,The Korean-Chinese Society of Law,
10.22420,Confederacao Nacional dos Trabalhadores em Educacao (CNTE),
10.22413,Vasundara Groups,
10.22419,The Chinese Prose Association of Korea,
10.22412,Russian State University of Tourism and Service,
10.22418,"Institute of Social Science, Gangwon University",
10.22421,Instituto de Estudos em Saude Coletiva - INESCO,
10.22414,"Institute for Russian, East European, and Eurasian Studies",
10.22423,Konkuk Research Institute of Real Estate and Urban Studies,
10.22424,Korean Society of Milk Science and Biotechnology,
10.22425,Sejong University Language Research Institute,
10.22426,"Australian Counselling Association, Inc.",
10.22427,National Institute of Environmental Health Sciences,
10.22430,Instituto Tecnologico Metropolitano (ITM),
10.22433,Canadian Journal of Nutrition,
10.22432,Fundacja Pedagogium,
10.22428,MRVSA Pubishing House,
10.22431,Escuela Superior de Administracion Publica,
10.22429,Editorial de la Universidad de Cantabria,
10.22437,"Faculty of Education and Teacher Training, Jambi University",
10.22435,Badan Penelitian dan Pengembangan Kesehatan,
10.22436,International Scientific Research Publications MY SDN. BHD.,
10.22438,Triveni Enterprises,
10.22443,Royal Microscopical Society,
10.22439,Copenhagen Business School,
10.22442,Journal of Liaquat University of Medical and Health Sciences (JLUMHS),
10.22440,"WERI Education Research Development Printing Publication, Ltd.",
10.22441,Universitas Mercu Buana,
10.22445,BSNV College Lucknow,
10.22449,FSBSI MHI,
10.22444,Information Bulletin on Variable Stars (IBVS),
10.22448,Amur State Medical Academy,
10.22447,Asian Trade Association,
10.22446,Multiculture and Peace Institute,
10.22450,Far Eastern State Agrarian University,
10.22453,National Council for Scientific Research - Lebanon,
10.22451,Escuela de Postgrado Neumann,
10.22452,Univ. of Malaya,
10.22454,Society of Teachers of Family Medicine,
10.22455,А. M. Gorky Institute of World Literature of the Russian Academy of Sciences,
10.21069,Acta Pediatrica Portuguesa,
10.22456,Universidade Federal do Rio Grande do Sul,
10.22463,Universidad Francisco de Paula Santander,
10.22460,IKIP Siliwangi Bandung,
10.22459,ANU Press,
10.22457,House of Scientific Research,
10.22462,Undersea and Hyperbaric Medical Society (UHMS),
10.22461,The Institute of Clinical Bioethics at Saint Joseph's University,
10.22458,Universidad Estatal a Distancia,
10.22465,Korean Urological Oncology Society,
10.22464,Diyalektolog - Ulusal Hakemlin Sosyal Arastirmalar Dergisi,
10.22466,Artvin Coruh Universitesi Uluslararasi Sosyal Bilimler Dergisi,
10.22480,Revista da Unifa,
10.22470,Korean Society of Pediatric Emergency Medicine,
10.22471,J-Institute,
10.22468,Asian Society of Cardiovascular Imaging,
10.22477,Revista Juventude e Politicas Publicas,
10.22467,Korean Wound Management Society,
10.22473,Korean Association of Thai Studies,
10.22479,Textura,
10.22474,Korean Society of Eastern Art Studies,
10.22483,Programa de Pos- Graduacao em Educacao – PPGE,
10.22472,Korean Physical Education Association for Girls and Women,
10.22476,Revista Critica,
10.22481,Universidade Estadual do Sudoeste da Bahia/Edicoes UESB,
10.22475,REBECA - Revista Brasileira de Estudos de Cinema e Audiovisual,
10.22482,Editora da Universidade de Sorocaba - UNISO,
10.22478,Portal de Periodicos UFPB,
10.22469,"Korean Society of Laryngology, Phoniatrics and Logopedics",
10.22484,Pos-Graduacao em Comunicacao e Cultura – PPGCC,
10.22485,"The Association of Engineers, India",
10.22486,The Indian Institute of Welding,
10.22488,Oklahoma State University Library,
10.22491,Tikinet Edicao Ltda. - EPP,
10.22489,Computing in Cardiology,
10.22490,Universidad Nacional Abierta y a Distancia,
10.22492,The International Academic Forum (IAFOR),
10.22493,University of Southampton,
10.22495,Virtus Interpress,
10.22494,Institute of Cell Therapy,
10.22496,"Archyworld Publishing, Ltd.",
10.22499,"Bureau of Meteorology, Australia",
10.22497,Universidad Privada Antenor Orrego,
10.22498,Past Global Changes (PAGES),
10.46937,Department of Communication and Community Development Sciences,
10.25015,Department of Communication and Community Development Sciences,
10.22500,Department of Communication and Community Development Sciences,
10.22501,Society for Artistic Research,
10.22512,Istanbul Universitesi Kadin Arastirmalari Dergisi,
10.22503,Informacios Tarsadalom,
10.22511,Korean Association of Women's History,
10.22507,Corporacion Universitaria Lasallista,
10.22506,"Society of Toxicology, India",
10.22508,FSBEI HE Krasnoyarsk State Agrarian University Achinsk Branch,
10.22509,Korea Food Service Association,
10.22505,The American Studies Association of Korea,
10.22502,Lumbini Medical College,
10.22510,Korean Financial Management Association,
10.22504,Gwangju Catholic University Institute for Theology,
10.22521,Universitepark,
10.22515,IAIN Surakarta,
10.22518,Universidad Sergio Arboleda,
10.22520,Parantez Teknologji Ltd,
10.22517,Universidad Tecnologica de Pereira - UTP,
10.22516,Asociacion Colombiana de Gastroenterologia,
10.22513,Baldwin Wallace University,
10.22529,Universidad Catolica de Cordoba,
10.22536,The Modern British and American Poetry Society of Korea,
10.22534,Broadcasting and Arts Research Institute,
10.22533,Atena Editora,
10.22535,Revista Cadernos de Pesquisa em Educacao,
10.22530,"Grupo de Investigacion Arte y Ciudad, UCM",
10.22531,Mugla Journal of Science and Technology,
10.22540,Hylonome Publications,
10.22537,Korean Society of Clinical Toxicology,
10.22522,Edward Bernays College of Communication Management,
10.22539,Hanyang Peace Institute,
10.22538,The Japan Center,
10.19046,International Scientific Publishers - Advances in Biomedicine and Pharmacy,
10.15200,"Authorea, Inc.",
10.22541,"Authorea, Inc.",
10.22544,Colegio Profesional de Psicologos de Costa Rica,
10.22548,Lajnah Pentashihan Mushaf Al-Qur'an,
10.22545,The Academy of Transdisciplinary Learning and Advanced Studies,
10.22547,Institute of Management Sciences,
10.22543,Valparaiso University,
10.22542,Nevada Water Resources Association,
10.22546,Sociedad Gallega de Medicina Interna,
10.22551,Grigore T. Popa University of Medicine and Pharmacy,
10.22549,Journal of Earth Energy Engineering,
10.22550,FUNCIVA Ediciones SL,
10.22556,The Convergence Tourism Contents Society,
10.22557,The Korean Language Society,
10.22552,"Jaipuria Institute of Management, India",
10.22555,Institute of Business Management,
10.22553,The Korean Educational Administration Society,
10.22559,Cyprus International University,
10.22554,Irish Learning Technology Association (ILTA),
10.22566,Brazilian Journal of Information Science: Research Trends,
10.22560,Associacao Nacional de Educacao Catolica - ANEC,
10.22565,International Journal of Nutrology,
10.22564,Sociedade Brasileira de Geofisica,
10.22570,Revista Ergodesign e HCI,
10.22561,Contabilidade Vista e Revista,
10.22569,Conselho Nacional de Controle Interno - CONACI,
10.22568,Jornal de Estudos Espiritas,
